Titel på forslaget;Saturationsmåling
Emneord;Behandling, akut behandling, vagtlæge, diagnostik, almen praksis
Baggrund for forslaget;Som sagkyndig almen medicin har jeg håndteret flere klagesager, hvor respiratorisk insufficiens er håndteret som hyperventilation med fatale konsekvenser.
Tilsyns- eller læringsaktivitet;Øget opmærksomhed på brug af saturationsmåling i almen praksis inklusiv saturationsmåler som en nødvendig ingrediens i lægetaskens indhold.
Patientgruppe ;Akut vurdering i akutmodtagelse og lægevagtsarbejde
Hvem omfattes af tilsynet;Vagtlæger og akutmodtagelser
Forventet effekt;Mere sikker vurdering af patienter med åndenød, så mistolkning som hyperventilation mindskes, så behandling med genånding i pose undgås, da det kan være fatalt ved respiratorisk insufficiens.
